{
  "version": 1,
  "backend": "ultralytics_yolo_pose",
  "model_id": "Ultralytics.YOLO11n.Pose.COCO",
  "revision": "ef787449d1fe015a77a27ca4d375ed0fde69495c",
  "filename": "yolo11n-pose.pt",
  "sha256": "869e83fcdffdc7371fa4e34cd8e51c838cc729571d1635e5141e3075e9319dc0",
  "size_bytes": 6255593,
  "source_url": "https://huggingface.co/Ultralytics/YOLO11/resolve/ef787449d1fe015a77a27ca4d375ed0fde69495c/yolo11n-pose.pt",
  "license_spdx": "AGPL-3.0",
  "license_url": "https://www.ultralytics.com/license",
  "class_name": "person",
  "keypoint_names": [
    "nose",
    "left_eye",
    "right_eye",
    "left_ear",
    "right_ear",
    "left_shoulder",
    "right_shoulder",
    "left_elbow",
    "right_elbow",
    "left_wrist",
    "right_wrist",
    "left_hip",
    "right_hip",
    "left_knee",
    "right_knee",
    "left_ankle",
    "right_ankle"
  ],
  "keypoint_dimensions": 3,
  "pickle_checkpoint": true,
  "subject_identity_inference": false,
  "posture_classification": false
}
