{
  "version": 1,
  "backend": "ultralytics_yolo_pose",
  "model_id": "Ultralytics.YOLO26m.Pose.COCO",
  "revision": "ultralytics-assets-v8.4.0",
  "filename": "yolo26m-pose.pt",
  "sha256": "2fbf16367022256a226035695c5c389384c6706e8bb8ab8fcd0e7976f05443c4",
  "size_bytes": 49036866,
  "source_url": "https://github.com/ultralytics/assets/releases/download/v8.4.0/yolo26m-pose.pt",
  "license_spdx": "AGPL-3.0",
  "license_url": "https://www.ultralytics.com/license",
  "class_name": "person",
  "keypoint_names": [
    "nose",
    "left_eye",
    "right_eye",
    "left_ear",
    "right_ear",
    "left_shoulder",
    "right_shoulder",
    "left_elbow",
    "right_elbow",
    "left_wrist",
    "right_wrist",
    "left_hip",
    "right_hip",
    "left_knee",
    "right_knee",
    "left_ankle",
    "right_ankle"
  ],
  "keypoint_dimensions": 3,
  "pickle_checkpoint": true,
  "subject_identity_inference": false,
  "posture_classification": false
}
